{
  "id": "lib-1911-ghazali-encyclopaedia-britannica-1911",
  "type": "article",
  "title": "Ghazali (Encyclopaedia Britannica, 1911)",
  "creators": [
    "Encyclopaedia Britannica, eleventh edition"
  ],
  "year": 1911,
  "language": "en",
  "categories": [
    "philosophy-and-theology",
    "institutions"
  ],
  "summary": "The life of al-Ghazali (1058 to 1111), professor at the Nizamiyya college in Baghdad who gave up his post, wandered for years, and wrote The Incoherence of the Philosophers and The Revival of the Religious Sciences. The article explains his attack on the philosophers and his defence of mystical experience, which Averroes later answered.",
  "url": "https://en.wikisource.org/wiki/1911%20Encyclop%C3%A6dia%20Britannica/Ghaz%C4%81l%C4%AB",
  "license": "public-domain",
  "hosted": false,
  "contentPath": null,
  "video": null,
  "source": {
    "name": "Wikisource",
    "url": "https://en.wikisource.org/wiki/1911%20Encyclop%C3%A6dia%20Britannica/Ghaz%C4%81l%C4%AB",
    "retrieved": "2026-10-16"
  },
  "relatedEvents": [],
  "confidence": "established"
}
