{
  "id": "lib-1911-the-alhambra-encyclopaedia-britannica-1911",
  "type": "article",
  "title": "The Alhambra (Encyclopaedia Britannica, 1911)",
  "creators": [
    "Encyclopaedia Britannica, eleventh edition"
  ],
  "year": 1911,
  "language": "en",
  "categories": [
    "art-and-architecture"
  ],
  "summary": "A description of the Alhambra at Granada, the palace and fortress of the Nasrid rulers built mainly in the thirteenth and fourteenth centuries: its courts, halls, stucco and tile work, and later history. A good short introduction before Irving's Tales of the Alhambra.",
  "url": "https://en.wikisource.org/wiki/1911%20Encyclop%C3%A6dia%20Britannica/Alhambra%2C%20The",
  "license": "public-domain",
  "hosted": false,
  "contentPath": null,
  "video": null,
  "source": {
    "name": "Wikisource",
    "url": "https://en.wikisource.org/wiki/1911%20Encyclop%C3%A6dia%20Britannica/Alhambra%2C%20The",
    "retrieved": "2026-10-16"
  },
  "relatedEvents": [],
  "confidence": "established"
}
